"No.","Time","Source","Destination","Protocol","Length","Info"
"1","0.000000","172.217.138.71","172.20.24.104","TLSv1.2","20784","Ignored Unknown Record"
"2","0.000000","172.217.138.71","172.20.24.104","TLSv1.2","1124","Ignored Unknown Record"
"3","0.000070","172.20.24.104","172.217.138.71","TCP","54","54989  >  443 [ACK] Seq=1 Ack=21801 Win=1023 Len=0"
"4","0.030786","172.20.24.104","172.64.155.209","TCP","54","55255  >  443 [ACK] Seq=1 Ack=1 Win=253 Len=0"
"5","0.032690","172.64.155.209","172.20.24.104","TLSv1.2","782","Application Data, Application Data, Application Data, Application Data, Application Data, Application Data, Application Data"
"6","0.077970","172.20.24.104","172.64.155.209","TCP","54","55255  >  443 [ACK] Seq=1 Ack=729 Win=255 Len=0"
"7","0.188457","54.148.71.251","172.20.24.104","TLSv1.2","284","Application Data"
"8","0.190103","172.20.24.104","54.148.71.251","TLSv1.2","89","Application Data"
"9","0.191553","54.148.71.251","172.20.24.104","TLSv1.2","85","Application Data"
"10","0.232649","172.20.24.104","54.148.71.251","TCP","54","55333  >  443 [ACK] Seq=36 Ack=262 Win=254 Len=0"
"11","0.563489","172.64.155.209","172.20.24.104","TLSv1.2","312","Application Data"
"12","0.608276","172.20.24.104","172.64.155.209","TCP","54","55255  >  443 [ACK] Seq=1 Ack=987 Win=254 Len=0"
"13","0.609749","172.64.155.209","172.20.24.104","TLSv1.2","130","Application Data, Application Data"
"14","0.654606","172.20.24.104","172.64.155.209","TCP","54","55255  >  443 [ACK] Seq=1 Ack=1063 Win=254 Len=0"
"15","0.763370","172.20.24.104","3.233.158.24","TCP","55","54318  >  443 [ACK] Seq=1 Ack=1 Win=254 Len=1 [TCP PDU reassembled in 675]"
"16","0.765689","3.233.158.24","172.20.24.104","TCP","66","443  >  54318 [ACK] Seq=1 Ack=2 Win=78 Len=0 SLE=1 SRE=2"
"17","0.855043","Intel_f4:55:3d","Broadcast","ARP","42","Who has 172.20.24.249? Tell 172.20.24.104"
"18","0.860437","Intel_2c:15:14","Intel_f4:55:3d","ARP","56","172.20.25.4 is at 3c:9c:0f:2c:15:14"
"19","0.860741","Intel_9c:37:9f","Intel_f4:55:3d","ARP","56","172.20.25.198 is at 00:91:9e:9c:37:9f"
"20","0.877092","Intel_79:5a:54","Intel_f4:55:3d","ARP","56","172.20.24.56 is at 50:84:92:79:5a:54"
"21","0.886038","Intel_99:ab:60","Intel_f4:55:3d","ARP","56","172.20.25.153 is at 84:5c:f3:99:ab:60"
"22","0.900934","Intel_a7:51:b6","Intel_f4:55:3d","ARP","56","172.20.24.188 is at d4:54:8b:a7:51:b6"
"23","0.907078","Intel_83:53:c9","Intel_f4:55:3d","ARP","56","172.20.24.123 is at 50:84:92:83:53:c9"
"24","0.927199","Intel_fd:8d:29","Intel_f4:55:3d","ARP","56","172.20.25.187 is at 0c:9a:3c:fd:8d:29"
"25","0.927839","Intel_de:f0:da","Intel_f4:55:3d","ARP","56","172.20.25.25 is at 7c:21:4a:de:f0:da"
"26","0.933114","172.20.24.104","148.113.20.112","TCP","55","49710  >  443 [ACK] Seq=1 Ack=1 Win=255 Len=1"
"27","0.934667","148.113.20.112","172.20.24.104","TCP","66","443  >  49710 [ACK] Seq=1 Ack=2 Win=491 Len=0 SLE=1 SRE=2"
"28","2.375202","172.20.24.104","172.217.138.71","TLSv1.2","2145","Application Data"
"29","2.375350","172.20.24.104","172.217.138.71","TLSv1.2","2069","Application Data"
"30","2.376784","172.217.138.71","172.20.24.104","TCP","60","443  >  54989 [ACK] Seq=21801 Ack=2092 Win=970 Len=0"
"31","2.377242","172.217.138.71","172.20.24.104","TCP","60","443  >  54989 [ACK] Seq=21801 Ack=4107 Win=975 Len=0"
"32","2.381435","172.217.138.71","172.20.24.104","TLSv1.2","1054","Application Data, Application Data"
"33","2.431389","172.20.24.104","172.217.138.71","TCP","54","54989  >  443 [ACK] Seq=4107 Ack=22801 Win=1020 Len=0"
"34","2.435339","172.217.138.71","172.20.24.104","TLSv1.2","510","Application Data, Application Data, Application Data, Application Data, Application Data, Application Data, Application Data, Application Data, Application Data, Application Data, Application Data, Application Data, Application Data, Application Data, Application Data"
"35","2.476777","172.20.24.104","172.217.138.71","TCP","54","54989  >  443 [ACK] Seq=4107 Ack=23257 Win=1023 Len=0"
"36","2.526990","172.20.24.104","142.251.221.196","TCP","66","55837  >  443 [SYN] Seq=0 Win=65535 Len=0 MSS=1460 WS=256 SACK_PERM"
"37","2.532109","142.251.221.196","172.20.24.104","TCP","66","443  >  55837 [SYN, ACK] Seq=0 Ack=1 Win=65535 Len=0 MSS=1382 SACK_PERM WS=256"
"38","2.532227","172.20.24.104","142.251.221.196","TCP","54","55837  >  443 [ACK] Seq=1 Ack=1 Win=65280 Len=0"
"39","2.533504","172.20.24.104","142.251.221.196","TLSv1.3","1842","Client Hello (SNI=www.google.com)"
"40","2.535395","142.251.221.196","172.20.24.104","TCP","60","443  >  55837 [ACK] Seq=1 Ack=1383 Win=64256 Len=0"
"41","2.535650","142.251.221.196","172.20.24.104","TCP","60","443  >  55837 [ACK] Seq=1 Ack=1789 Win=64000 Len=0"
"42","2.571037","142.251.221.196","172.20.24.104","TLSv1.3","1436","Server Hello, Change Cipher Spec"
"43","2.571564","142.251.221.196","172.20.24.104","TCP","1436","443  >  55837 [PSH, ACK] Seq=1383 Ack=1789 Win=64000 Len=1382 [TCP PDU reassembled in 44]"
"44","2.571564","142.251.221.196","172.20.24.104","TLSv1.3","1366","Application Data"
"45","2.571634","172.20.24.104","142.251.221.196","TCP","54","55837  >  443 [ACK] Seq=1789 Ack=4077 Win=65280 Len=0"
"46","2.572644","172.20.24.104","142.251.221.196","TLSv1.3","128","Change Cipher Spec, Application Data"
"47","2.574203","142.251.221.196","172.20.24.104","TCP","60","443  >  55837 [ACK] Seq=4077 Ack=1863 Win=64000 Len=0"
"48","2.969788","100.25.240.30","172.20.24.104","TLSv1.2","100","Application Data"
"49","2.970118","172.20.24.104","100.25.240.30","TCP","54","55724  >  443 [FIN, ACK] Seq=1 Ack=47 Win=253 Len=0"
"50","2.970146","100.25.240.30","172.20.24.104","TLSv1.2","85","Encrypted Alert"
"51","2.970208","172.20.24.104","100.25.240.30","TCP","54","55724  >  443 [RST, ACK] Seq=2 Ack=78 Win=0 Len=0"
"52","2.971840","100.25.240.30","172.20.24.104","TCP","60","443  >  55724 [ACK] Seq=79 Ack=2 Win=158 Len=0"
"53","4.805302","172.20.24.104","104.18.32.47","TCP","55","53466  >  443 [ACK] Seq=1 Ack=1 Win=255 Len=1 [TCP PDU reassembled in 165]"
"54","4.807280","104.18.32.47","172.20.24.104","TCP","66","443  >  53466 [ACK] Seq=1 Ack=2 Win=31 Len=0 SLE=1 SRE=2"
"55","6.934269","172.20.24.104","142.250.196.163","TCP","55","55536  >  443 [ACK] Seq=1 Ack=1 Win=255 Len=1 [TCP PDU reassembled in 354]"
"56","6.935796","142.250.196.163","172.20.24.104","TCP","66","443  >  55536 [ACK] Seq=1 Ack=2 Win=244 Len=0 SLE=1 SRE=2"
"57","7.322940","Intel_f4:55:3d","Broadcast","ARP","42","Who has 172.20.24.249? Tell 172.20.24.104"
"58","7.661581","172.20.24.104","172.20.31.255","UDP","82","58200  >  1947 Len=40"
"59","7.661653","172.20.24.104","255.255.255.255","UDP","82","58201  >  1947 Len=40"
"60","7.703932","172.20.24.104","172.217.138.71","TLSv1.2","2145","Application Data"
"61","7.704092","172.20.24.104","172.217.138.71","TLSv1.2","2069","Application Data"
"62","7.706783","172.217.138.71","172.20.24.104","TCP","60","443  >  54989 [ACK] Seq=23257 Ack=6198 Win=978 Len=0"
"63","7.708173","172.217.138.71","172.20.24.104","TCP","60","443  >  54989 [ACK] Seq=23257 Ack=8213 Win=978 Len=0"
"64","7.711923","172.217.138.71","172.20.24.104","TLSv1.2","1029","Application Data"
"65","7.714652","172.217.138.71","172.20.24.104","TLSv1.2","1436","Application Data, Application Data, Application Data, Application Data, Application Data, Application Data, Application Data, Application Data, Application Data, Application Data, Application Data, Application Data, Application Data, Application Data, Application Data, Application Data, Application Data, Application Data, Application Data, Application Data"
"66","7.714652","172.217.138.71","172.20.24.104","TCP","1436","443  >  54989 [ACK] Seq=25614 Ack=8213 Win=978 Len=1382 [TCP PDU reassembled in 80]"
"67","7.714652","172.217.138.71","172.20.24.104","TCP","1436","443  >  54989 [ACK] Seq=26996 Ack=8213 Win=978 Len=1382 [TCP PDU reassembled in 80]"
"68","7.714652","172.217.138.71","172.20.24.104","TCP","1436","443  >  54989 [ACK] Seq=28378 Ack=8213 Win=978 Len=1382 [TCP PDU reassembled in 80]"
"69","7.714652","172.217.138.71","172.20.24.104","TCP","1436","443  >  54989 [ACK] Seq=29760 Ack=8213 Win=978 Len=1382 [TCP PDU reassembled in 80]"
"70","7.714652","172.217.138.71","172.20.24.104","TCP","1436","443  >  54989 [ACK] Seq=31142 Ack=8213 Win=978 Len=1382 [TCP PDU reassembled in 80]"
"71","7.714652","172.217.138.71","172.20.24.104","TCP","1436","443  >  54989 [ACK] Seq=32524 Ack=8213 Win=978 Len=1382 [TCP PDU reassembled in 80]"
"72","7.714652","172.217.138.71","172.20.24.104","TCP","1436","443  >  54989 [ACK] Seq=33906 Ack=8213 Win=978 Len=1382 [TCP PDU reassembled in 80]"
"73","7.714799","172.20.24.104","172.217.138.71","TCP","54","54989  >  443 [ACK] Seq=8213 Ack=35288 Win=1023 Len=0"
"74","7.716144","172.217.138.71","172.20.24.104","TCP","1436","443  >  54989 [ACK] Seq=35288 Ack=8213 Win=978 Len=1382 [TCP PDU reassembled in 80]"
"75","7.716204","172.20.24.104","172.217.138.71","TCP","54","54989  >  443 [ACK] Seq=8213 Ack=36670 Win=1023 Len=0"
"76","7.717831","172.217.138.71","172.20.24.104","TCP","1436","443  >  54989 [ACK] Seq=36670 Ack=8213 Win=978 Len=1382 [TCP PDU reassembled in 80]"
"77","7.717831","172.217.138.71","172.20.24.104","TCP","1436","443  >  54989 [ACK] Seq=38052 Ack=8213 Win=978 Len=1382 [TCP PDU reassembled in 80]"
"78","7.717879","172.20.24.104","172.217.138.71","TCP","54","54989  >  443 [ACK] Seq=8213 Ack=39434 Win=1023 Len=0"
"79","7.723091","172.217.138.71","172.20.24.104","TCP","1436","443  >  54989 [ACK] Seq=39434 Ack=8213 Win=978 Len=1382 [TCP PDU reassembled in 80]"
"80","7.723091","172.217.138.71","172.20.24.104","TLSv1.2","1436","Application Data"
"81","7.723091","172.217.138.71","172.20.24.104","TCP","1436","443  >  54989 [ACK] Seq=42198 Ack=8213 Win=978 Len=1382 [TCP PDU reassembled in 92]"
"82","7.723091","172.217.138.71","172.20.24.104","TCP","1436","443  >  54989 [ACK] Seq=43580 Ack=8213 Win=978 Len=1382 [TCP PDU reassembled in 92]"
"83","7.723091","172.217.138.71","172.20.24.104","TCP","1436","443  >  54989 [ACK] Seq=44962 Ack=8213 Win=978 Len=1382 [TCP PDU reassembled in 92]"
"84","7.723091","172.217.138.71","172.20.24.104","TCP","1436","443  >  54989 [ACK] Seq=46344 Ack=8213 Win=978 Len=1382 [TCP PDU reassembled in 92]"
"85","7.723091","172.217.138.71","172.20.24.104","TCP","1436","443  >  54989 [ACK] Seq=47726 Ack=8213 Win=978 Len=1382 [TCP PDU reassembled in 92]"
"86","7.723091","172.217.138.71","172.20.24.104","TCP","1436","443  >  54989 [ACK] Seq=49108 Ack=8213 Win=978 Len=1382 [TCP PDU reassembled in 92]"
"87","7.723091","172.217.138.71","172.20.24.104","TCP","1436","443  >  54989 [ACK] Seq=50490 Ack=8213 Win=978 Len=1382 [TCP PDU reassembled in 92]"
"88","7.723091","172.217.138.71","172.20.24.104","TCP","1436","443  >  54989 [ACK] Seq=51872 Ack=8213 Win=978 Len=1382 [TCP PDU reassembled in 92]"
"89","7.723091","172.217.138.71","172.20.24.104","TCP","1436","443  >  54989 [ACK] Seq=53254 Ack=8213 Win=978 Len=1382 [TCP PDU reassembled in 92]"
"90","7.723091","172.217.138.71","172.20.24.104","TCP","1436","443  >  54989 [ACK] Seq=54636 Ack=8213 Win=978 Len=1382 [TCP PDU reassembled in 92]"
"91","7.723091","172.217.138.71","172.20.24.104","TCP","1436","443  >  54989 [ACK] Seq=56018 Ack=8213 Win=978 Len=1382 [TCP PDU reassembled in 92]"
"92","7.723091","172.217.138.71","172.20.24.104","TLSv1.2","1436","Application Data"
"93","7.723091","172.217.138.71","172.20.24.104","TCP","1436","443  >  54989 [ACK] Seq=58782 Ack=8213 Win=978 Len=1382 [TCP PDU reassembled in 101]"
"94","7.723091","172.217.138.71","172.20.24.104","TCP","1436","443  >  54989 [ACK] Seq=60164 Ack=8213 Win=978 Len=1382 [TCP PDU reassembled in 101]"
"95","7.723199","172.20.24.104","172.217.138.71","TCP","54","54989  >  443 [ACK] Seq=8213 Ack=61546 Win=1023 Len=0"
"96","7.725395","172.217.138.71","172.20.24.104","TCP","1436","443  >  54989 [ACK] Seq=61546 Ack=8213 Win=978 Len=1382 [TCP PDU reassembled in 101]"
"97","7.725395","172.217.138.71","172.20.24.104","TCP","1436","443  >  54989 [ACK] Seq=62928 Ack=8213 Win=978 Len=1382 [TCP PDU reassembled in 101]"
"98","7.725395","172.217.138.71","172.20.24.104","TCP","1436","443  >  54989 [ACK] Seq=64310 Ack=8213 Win=978 Len=1382 [TCP PDU reassembled in 101]"
"99","7.725395","172.217.138.71","172.20.24.104","TCP","1436","443  >  54989 [ACK] Seq=65692 Ack=8213 Win=978 Len=1382 [TCP PDU reassembled in 101]"
"100","7.725456","172.20.24.104","172.217.138.71","TCP","54","54989  >  443 [ACK] Seq=8213 Ack=67074 Win=1023 Len=0"
"101","7.729134","172.217.138.71","172.20.24.104","TLSv1.2","22166","Application Data"
"102","7.729134","172.217.138.71","172.20.24.104","TLSv1.2","1384","Application Data"
"103","7.729134","172.217.138.71","172.20.24.104","TLSv1.2","20784","Application Data"
"104","7.729294","172.20.24.104","172.217.138.71","TCP","54","54989  >  443 [ACK] Seq=8213 Ack=111246 Win=1023 Len=0"
"105","7.729486","172.217.138.71","172.20.24.104","TCP","1436","443  >  54989 [ACK] Seq=111246 Ack=8213 Win=978 Len=1382 [TCP PDU reassembled in 108]"
"106","7.730616","172.217.138.71","172.20.24.104","TCP","1436","443  >  54989 [ACK] Seq=112628 Ack=8213 Win=978 Len=1382 [TCP PDU reassembled in 108]"
"107","7.730669","172.20.24.104","172.217.138.71","TCP","54","54989  >  443 [ACK] Seq=8213 Ack=114010 Win=1023 Len=0"
"108","7.734661","172.217.138.71","172.20.24.104","TLSv1.2","47042","Application Data, Application Data, Application Data"
"109","7.734739","172.20.24.104","172.217.138.71","TCP","54","54989  >  443 [ACK] Seq=8213 Ack=160998 Win=1023 Len=0"
"110","7.735171","172.217.138.71","172.20.24.104","TCP","1436","443  >  54989 [ACK] Seq=160998 Ack=8213 Win=978 Len=1382 [TCP PDU reassembled in 113]"
"111","7.736649","172.217.138.71","172.20.24.104","TCP","1436","443  >  54989 [ACK] Seq=162380 Ack=8213 Win=978 Len=1382 [TCP PDU reassembled in 113]"
"112","7.736703","172.20.24.104","172.217.138.71","TCP","54","54989  >  443 [ACK] Seq=8213 Ack=163762 Win=1023 Len=0"
"113","7.740149","172.217.138.71","172.20.24.104","TLSv1.2","47042","Application Data, Application Data, Application Data, Application Data, Application Data, Application Data, Application Data, Application Data, Application Data, Application Data, Application Data, Application Data"
"114","7.740215","172.20.24.104","172.217.138.71","TCP","54","54989  >  443 [ACK] Seq=8213 Ack=210750 Win=1023 Len=0"
"115","7.740759","172.217.138.71","172.20.24.104","TCP","1436","443  >  54989 [ACK] Seq=210750 Ack=8213 Win=978 Len=1382 [TCP PDU reassembled in 118]"
"116","7.742104","172.217.138.71","172.20.24.104","TCP","1436","443  >  54989 [ACK] Seq=212132 Ack=8213 Win=978 Len=1382 [TCP PDU reassembled in 118]"
"117","7.742138","172.20.24.104","172.217.138.71","TCP","54","54989  >  443 [ACK] Seq=8213 Ack=213514 Win=1023 Len=0"
"118","7.745593","172.217.138.71","172.20.24.104","TLSv1.2","47042","Application Data, Application Data, Application Data"
"119","7.745665","172.20.24.104","172.217.138.71","TCP","54","54989  >  443 [ACK] Seq=8213 Ack=260502 Win=1023 Len=0"
"120","7.746291","172.217.138.71","172.20.24.104","TCP","1436","443  >  54989 [ACK] Seq=260502 Ack=8213 Win=978 Len=1382 [TCP PDU reassembled in 123]"
"121","7.747611","172.217.138.71","172.20.24.104","TCP","1436","443  >  54989 [ACK] Seq=261884 Ack=8213 Win=978 Len=1382 [TCP PDU reassembled in 123]"
"122","7.747651","172.20.24.104","172.217.138.71","TCP","54","54989  >  443 [ACK] Seq=8213 Ack=263266 Win=1023 Len=0"
"123","7.750878","172.217.138.71","172.20.24.104","TLSv1.2","47042","Application Data, Application Data, Application Data"
"124","7.750950","172.20.24.104","172.217.138.71","TCP","54","54989  >  443 [ACK] Seq=8213 Ack=310254 Win=1023 Len=0"
"125","7.751498","172.217.138.71","172.20.24.104","TCP","1436","443  >  54989 [ACK] Seq=310254 Ack=8213 Win=978 Len=1382 [TCP PDU reassembled in 128]"
"126","7.752734","172.217.138.71","172.20.24.104","TCP","1436","443  >  54989 [ACK] Seq=311636 Ack=8213 Win=978 Len=1382 [TCP PDU reassembled in 128]"
"127","7.752797","172.20.24.104","172.217.138.71","TCP","54","54989  >  443 [ACK] Seq=8213 Ack=313018 Win=1023 Len=0"
"128","7.755392","172.217.138.71","172.20.24.104","TLSv1.2","37368","Application Data, Application Data, Application Data, Application Data, Application Data, Application Data"
"129","7.755392","172.217.138.71","172.20.24.104","TCP","832","443  >  54989 [PSH, ACK] Seq=350332 Ack=8213 Win=978 Len=778 [TCP PDU reassembled in 132]"
"130","7.755464","172.20.24.104","172.217.138.71","TCP","54","54989  >  443 [ACK] Seq=8213 Ack=351110 Win=1023 Len=0"
"131","7.757004","172.217.138.71","172.20.24.104","TCP","1436","443  >  54989 [ACK] Seq=351110 Ack=8213 Win=978 Len=1382 [TCP PDU reassembled in 132]"
"132","7.757650","172.217.138.71","172.20.24.104","TLSv1.2","670","Application Data, Application Data, Application Data, Application Data, Application Data, Application Data"
"133","7.757690","172.20.24.104","172.217.138.71","TCP","54","54989  >  443 [ACK] Seq=8213 Ack=353108 Win=1023 Len=0"
"134","7.854994","Intel_f4:55:3d","Broadcast","ARP","42","Who has 172.20.24.249? Tell 172.20.24.104"
"135","7.860030","Intel_99:ab:60","Intel_f4:55:3d","ARP","56","172.20.25.153 is at 84:5c:f3:99:ab:60"
"136","7.886262","172.20.24.104","172.20.31.255","UDP","82","58200  >  1947 Len=40"
"137","7.886265","172.20.24.104","255.255.255.255","UDP","82","58201  >  1947 Len=40"
"138","8.120531","172.20.24.104","172.20.31.255","UDP","82","58200  >  1947 Len=40"
"139","8.120541","172.20.24.104","255.255.255.255","UDP","82","58201  >  1947 Len=40"
"140","8.355132","172.20.24.104","172.20.31.255","UDP","82","58200  >  1947 Len=40"
"141","8.355136","172.20.24.104","255.255.255.255","UDP","82","58201  >  1947 Len=40"
"142","8.588622","172.20.24.104","172.20.31.255","UDP","82","58200  >  1947 Len=40"
"143","8.588622","172.20.24.104","255.255.255.255","UDP","82","58201  >  1947 Len=40"
"144","8.823639","172.20.24.104","172.20.31.255","UDP","82","58200  >  1947 Len=40"
"145","8.823641","172.20.24.104","255.255.255.255","UDP","82","58201  >  1947 Len=40"
"146","8.854922","Intel_f4:55:3d","Broadcast","ARP","42","Who has 172.20.24.249? Tell 172.20.24.104"
"147","8.858643","Intel_9c:37:9f","Intel_f4:55:3d","ARP","56","172.20.25.198 is at 00:91:9e:9c:37:9f"
"148","8.873934","Intel_99:ab:60","Intel_f4:55:3d","ARP","56","172.20.25.153 is at 84:5c:f3:99:ab:60"
"149","8.892770","172.20.24.104","172.217.138.71","TLSv1.2","2145","Application Data"
"150","8.892913","172.20.24.104","172.217.138.71","TLSv1.2","2069","Application Data"
"151","8.894410","172.217.138.71","172.20.24.104","TCP","60","443  >  54989 [ACK] Seq=353108 Ack=10304 Win=978 Len=0"
"152","8.894686","172.217.138.71","172.20.24.104","TCP","60","443  >  54989 [ACK] Seq=353108 Ack=12319 Win=978 Len=0"
"153","8.900064","172.217.138.71","172.20.24.104","TLSv1.2","1029","Application Data"
"154","8.915152","Intel_fd:8d:29","Intel_f4:55:3d","ARP","56","172.20.25.187 is at 0c:9a:3c:fd:8d:29"
"155","8.948855","172.20.24.104","172.217.138.71","TCP","54","54989  >  443 [ACK] Seq=12319 Ack=354083 Win=1020 Len=0"
"156","8.949030","Intel_2c:15:14","Intel_f4:55:3d","ARP","56","172.20.25.4 is at 3c:9c:0f:2c:15:14"
"157","8.950199","172.217.138.71","172.20.24.104","TLSv1.2","535","Application Data, Application Data, Application Data, Application Data, Application Data, Application Data, Application Data, Application Data, Application Data, Application Data, Application Data, Application Data, Application Data, Application Data, Application Data, Application Data"
"158","8.994739","172.20.24.104","172.217.138.71","TCP","54","54989  >  443 [ACK] Seq=12319 Ack=354564 Win=1023 Len=0"
"159","9.057039","172.20.24.104","172.20.31.255","UDP","82","58200  >  1947 Len=40"
"160","9.057122","172.20.24.104","255.255.255.255","UDP","82","58201  >  1947 Len=40"
"161","9.291674","172.20.24.104","255.255.255.255","UDP","82","58201  >  1947 Len=40"
"162","9.291680","172.20.24.104","172.20.31.255","UDP","82","58200  >  1947 Len=40"
"163","9.525464","172.20.24.104","172.20.31.255","UDP","82","58200  >  1947 Len=40"
"164","9.525464","172.20.24.104","255.255.255.255","UDP","82","58201  >  1947 Len=40"
"165","9.591412","172.20.24.104","104.18.32.47","TLSv1.2","233","Ignored Unknown Record"
"166","9.591562","172.20.24.104","104.18.32.47","TLSv1.2","93","Application Data"
"167","9.591614","172.20.24.104","104.18.32.47","TLSv1.2","4143","Application Data"
"168","9.591804","172.20.24.104","172.64.41.3","TLSv1.2","110","Application Data"
"169","9.591869","172.20.24.104","172.64.41.3","TLSv1.2","93","Application Data"
"170","9.591936","172.20.24.104","172.64.41.3","TLSv1.2","110","Application Data"
"171","9.591989","172.20.24.104","172.64.41.3","TLSv1.2","213","Application Data"
"172","9.592033","172.20.24.104","172.64.41.3","TLSv1.2","213","Application Data"
"173","9.593455","104.18.32.47","172.20.24.104","TCP","60","443  >  53466 [ACK] Seq=1 Ack=181 Win=31 Len=0"
"174","9.593805","104.18.32.47","172.20.24.104","TCP","60","443  >  53466 [ACK] Seq=1 Ack=220 Win=31 Len=0"
"175","9.593805","104.18.32.47","172.20.24.104","TCP","60","443  >  53466 [ACK] Seq=1 Ack=1602 Win=31 Len=0"
"176","9.593805","104.18.32.47","172.20.24.104","TCP","60","443  >  53466 [ACK] Seq=1 Ack=2984 Win=31 Len=0"
"177","9.593805","104.18.32.47","172.20.24.104","TCP","60","443  >  53466 [ACK] Seq=1 Ack=4309 Win=31 Len=0"
"178","9.594207","172.64.41.3","172.20.24.104","TCP","60","443  >  53200 [ACK] Seq=1 Ack=311 Win=26 Len=0"
"179","9.597120","172.64.41.3","172.20.24.104","TLSv1.2","89","Application Data"
"180","9.597362","104.18.32.47","172.20.24.104","TLSv1.2","93","Application Data"
"181","9.649128","172.20.24.104","172.64.41.3","TCP","54","53200  >  443 [ACK] Seq=470 Ack=36 Win=251 Len=0"
"182","9.649130","172.20.24.104","104.18.32.47","TCP","54","53466  >  443 [ACK] Seq=4309 Ack=40 Win=255 Len=0"
"183","9.650886","172.64.41.3","172.20.24.104","TLSv1.2","1226","Application Data, Application Data, Application Data, Application Data, Application Data"
"184","9.651945","172.20.24.104","172.64.41.3","TLSv1.2","89","Application Data"
"185","9.682861","104.18.32.47","172.20.24.104","TLSv1.2","993","Application Data, Application Data"
"186","9.684847","172.20.24.104","104.18.32.47","TLSv1.2","89","Application Data"
"187","9.686209","104.18.32.47","172.20.24.104","TLSv1.2","85","Application Data"
"188","9.696760","172.64.41.3","172.20.24.104","TCP","60","443  >  53200 [ACK] Seq=1208 Ack=505 Win=26 Len=0"
"189","9.726934","172.20.24.104","104.18.32.47","TCP","54","53466  >  443 [ACK] Seq=4344 Ack=1010 Win=251 Len=0"
"190","9.758036","172.20.24.104","255.255.255.255","UDP","82","58201  >  1947 Len=40"
"191","9.758061","172.20.24.104","172.20.31.255","UDP","82","58200  >  1947 Len=40"
"192","9.990916","172.20.24.104","255.255.255.255","UDP","82","58201  >  1947 Len=40"
"193","9.990918","172.20.24.104","172.20.31.255","UDP","82","58200  >  1947 Len=40"
"194","10.036976","172.20.24.104","142.250.206.3","TCP","55","53186  >  443 [ACK] Seq=1 Ack=1 Win=255 Len=1 [TCP PDU reassembled in 283]"
"195","10.038765","142.250.206.3","172.20.24.104","TCP","66","443  >  53186 [ACK] Seq=1 Ack=2 Win=438 Len=0 SLE=1 SRE=2"
"196","10.226721","172.20.24.104","255.255.255.255","UDP","82","58201  >  1947 Len=40"
"197","10.226725","172.20.24.104","172.20.31.255","UDP","82","58200  >  1947 Len=40"
"198","10.461253","172.20.24.104","255.255.255.255","UDP","82","58201  >  1947 Len=40"
"199","10.461253","172.20.24.104","172.20.31.255","UDP","82","58200  >  1947 Len=40"
"200","10.694886","172.20.24.104","255.255.255.255","UDP","82","58201  >  1947 Len=40"
"201","10.694903","172.20.24.104","172.20.31.255","UDP","82","58200  >  1947 Len=40"
"202","10.927105","172.20.24.104","255.255.255.255","UDP","82","58201  >  1947 Len=40"
"203","10.927129","172.20.24.104","172.20.31.255","UDP","82","58200  >  1947 Len=40"
"204","10.942231","172.20.24.104","148.113.20.112","TCP","55","[TCP Keep-Alive] 49710  >  443 [ACK] Seq=1 Ack=1 Win=255 Len=1"
"205","10.944279","148.113.20.112","172.20.24.104","TCP","66","[TCP Keep-Alive ACK] 443  >  49710 [ACK] Seq=1 Ack=2 Win=491 Len=0 SLE=1 SRE=2"
"206","11.128390","172.20.24.104","74.125.130.188","TCP","55","50061  >  5228 [ACK] Seq=1 Ack=1 Win=255 Len=1"
"207","11.130181","74.125.130.188","172.20.24.104","TCP","66","5228  >  50061 [ACK] Seq=1 Ack=2 Win=250 Len=0 SLE=1 SRE=2"
"208","11.159177","172.20.24.104","255.255.255.255","UDP","82","58201  >  1947 Len=40"
"209","11.159180","172.20.24.104","172.20.31.255","UDP","82","58200  >  1947 Len=40"
"210","11.362887","172.20.24.104","74.125.200.188","TCP","55","50064  >  5228 [ACK] Seq=1 Ack=1 Win=255 Len=1"
"211","11.365076","74.125.200.188","172.20.24.104","TCP","66","5228  >  50064 [ACK] Seq=1 Ack=2 Win=250 Len=0 SLE=1 SRE=2"
"212","11.393522","172.20.24.104","255.255.255.255","UDP","82","58201  >  1947 Len=40"
"213","11.393565","172.20.24.104","172.20.31.255","UDP","82","58200  >  1947 Len=40"
"214","11.627022","172.20.24.104","172.20.31.255","UDP","82","58200  >  1947 Len=40"
"215","11.627034","172.20.24.104","255.255.255.255","UDP","82","58201  >  1947 Len=40"
"216","11.917813","104.18.26.48","172.20.24.104","TLSv1.2","81","Application Data"
"217","11.918951","172.20.24.104","104.18.26.48","TLSv1.2","85","Application Data"
"218","11.920294","104.18.26.48","172.20.24.104","TCP","60","443  >  50263 [ACK] Seq=28 Ack=32 Win=8 Len=0"
"219","12.538777","142.251.221.196","172.20.24.104","TCP","60","443  >  55837 [FIN, ACK] Seq=4077 Ack=1863 Win=64000 Len=0"
"220","12.538886","172.20.24.104","142.251.221.196","TCP","54","55837  >  443 [ACK] Seq=1863 Ack=4078 Win=65280 Len=0"
"221","14.094552","172.20.24.104","1.1.1.1","DNS","80","Standard query 0x0001 PTR 1.1.1.1.in-addr.arpa"
"222","14.099540","1.1.1.1","172.20.24.104","DNS","109","Standard query response 0x0001 PTR 1.1.1.1.in-addr.arpa PTR one.one.one.one"
"223","14.101351","172.20.24.104","1.1.1.1","DNS","81","Standard query 0x0002 A google.com.VITCHOSDNS"
"224","14.130026","1.1.1.1","172.20.24.104","DNS","156","Standard query response 0x0002 No such name A google.com.VITCHOSDNS SOA a.root-servers.net"
"225","14.130405","172.20.24.104","1.1.1.1","DNS","81","Standard query 0x0003 AAAA google.com.VITCHOSDNS"
"226","14.139909","1.1.1.1","172.20.24.104","DNS","156","Standard query response 0x0003 No such name AAAA google.com.VITCHOSDNS SOA a.root-servers.net"
"227","14.140396","172.20.24.104","1.1.1.1","DNS","70","Standard query 0x0004 A google.com"
"228","14.145656","1.1.1.1","172.20.24.104","DNS","86","Standard query response 0x0004 A google.com A 142.250.182.110"
"229","14.150124","172.20.24.104","1.1.1.1","DNS","70","Standard query 0x0005 AAAA google.com"
"230","14.155821","1.1.1.1","172.20.24.104","DNS","98","Standard query response 0x0005 AAAA google.com AAAA 2404:6800:4007:829::200e"
"231","14.291986","172.20.24.104","172.217.138.71","TLSv1.2","2145","Application Data"
"232","14.292125","172.20.24.104","172.217.138.71","TLSv1.2","2069","Application Data"
"233","14.293638","172.217.138.71","172.20.24.104","TCP","60","443  >  54989 [ACK] Seq=354564 Ack=14410 Win=970 Len=0"
"234","14.293917","172.217.138.71","172.20.24.104","TCP","60","443  >  54989 [ACK] Seq=354564 Ack=16425 Win=975 Len=0"
"235","14.298322","172.217.138.71","172.20.24.104","TLSv1.2","1080","Application Data, Application Data, Application Data"
"236","14.299380","172.217.138.71","172.20.24.104","TLSv1.2","11110","Application Data, Application Data, Application Data, Application Data, Application Data, Application Data, Application Data, Application Data, Application Data, Application Data, Application Data, Application Data, Application Data, Application Data, Application Data, Application Data, Application Data, Application Data"
"237","14.299467","172.20.24.104","172.217.138.71","TCP","54","54989  >  443 [ACK] Seq=16425 Ack=366646 Win=1023 Len=0"
"238","14.299851","172.217.138.71","172.20.24.104","TCP","1436","443  >  54989 [ACK] Seq=366646 Ack=16425 Win=978 Len=1382 [TCP PDU reassembled in 241]"
"239","14.299907","172.20.24.104","172.217.138.71","TCP","54","54989  >  443 [ACK] Seq=16425 Ack=368028 Win=1023 Len=0"
"240","14.301058","172.217.138.71","172.20.24.104","TCP","1436","443  >  54989 [ACK] Seq=368028 Ack=16425 Win=978 Len=1382 [TCP PDU reassembled in 241]"
"241","14.303158","172.217.138.71","172.20.24.104","TLSv1.2","24930","Application Data, Application Data"
"242","14.303281","172.20.24.104","172.217.138.71","TCP","54","54989  >  443 [ACK] Seq=16425 Ack=394286 Win=1023 Len=0"
"243","14.303731","172.217.138.71","172.20.24.104","TCP","1436","443  >  54989 [ACK] Seq=394286 Ack=16425 Win=978 Len=1382 [TCP PDU reassembled in 246]"
"244","14.303782","172.20.24.104","172.217.138.71","TCP","54","54989  >  443 [ACK] Seq=16425 Ack=395668 Win=1023 Len=0"
"245","14.305032","172.217.138.71","172.20.24.104","TCP","1436","443  >  54989 [ACK] Seq=395668 Ack=16425 Win=978 Len=1382 [TCP PDU reassembled in 246]"
"246","14.308320","172.217.138.71","172.20.24.104","TLSv1.2","23548","Application Data"
"247","14.308320","172.217.138.71","172.20.24.104","TLSv1.2","1333","Application Data"
"248","14.308320","172.217.138.71","172.20.24.104","TLSv1.2","22166","Application Data"
"249","14.308463","172.20.24.104","172.217.138.71","TCP","54","54989  >  443 [ACK] Seq=16425 Ack=443935 Win=1023 Len=0"
"250","14.309156","172.217.138.71","172.20.24.104","TCP","2818","443  >  54989 [ACK] Seq=443935 Ack=16425 Win=978 Len=2764 [TCP PDU reassembled in 254]"
"251","14.309256","172.20.24.104","172.217.138.71","TCP","54","54989  >  443 [ACK] Seq=16425 Ack=446699 Win=1023 Len=0"
"252","14.310572","172.217.138.71","172.20.24.104","TCP","1436","443  >  54989 [ACK] Seq=446699 Ack=16425 Win=978 Len=1382 [TCP PDU reassembled in 254]"
"253","14.310617","172.20.24.104","172.217.138.71","TCP","54","54989  >  443 [ACK] Seq=16425 Ack=448081 Win=1023 Len=0"
"254","14.314039","172.217.138.71","172.20.24.104","TLSv1.2","44278","Application Data, Application Data, Application Data"
"255","14.314146","172.20.24.104","172.217.138.71","TCP","54","54989  >  443 [ACK] Seq=16425 Ack=492305 Win=1023 Len=0"
"256","14.314581","172.217.138.71","172.20.24.104","TCP","2818","443  >  54989 [ACK] Seq=492305 Ack=16425 Win=978 Len=2764 [TCP PDU reassembled in 259]"
"257","14.314628","172.20.24.104","172.217.138.71","TCP","54","54989  >  443 [ACK] Seq=16425 Ack=495069 Win=1023 Len=0"
"258","14.316153","172.217.138.71","172.20.24.104","TCP","1436","443  >  54989 [ACK] Seq=495069 Ack=16425 Win=978 Len=1382 [TCP PDU reassembled in 259]"
"259","14.318848","172.217.138.71","172.20.24.104","TLSv1.2","44278","Application Data, Application Data, Application Data, Application Data, Application Data, Application Data, Application Data, Application Data, Application Data, Application Data, Application Data, Application Data"
"260","14.318945","172.20.24.104","172.217.138.71","TCP","54","54989  >  443 [ACK] Seq=16425 Ack=540675 Win=1023 Len=0"
"261","14.319933","172.217.138.71","172.20.24.104","TCP","2818","443  >  54989 [ACK] Seq=540675 Ack=16425 Win=978 Len=2764 [TCP PDU reassembled in 265]"
"262","14.320006","172.20.24.104","172.217.138.71","TCP","54","54989  >  443 [ACK] Seq=16425 Ack=543439 Win=1023 Len=0"
"263","14.320619","172.217.138.71","172.20.24.104","TCP","1436","443  >  54989 [ACK] Seq=543439 Ack=16425 Win=978 Len=1382 [TCP PDU reassembled in 265]"
"264","14.320673","172.20.24.104","172.217.138.71","TCP","54","54989  >  443 [ACK] Seq=16425 Ack=544821 Win=1023 Len=0"
"265","14.323673","172.217.138.71","172.20.24.104","TLSv1.2","44278","Application Data, Application Data, Application Data"
"266","14.323783","172.20.24.104","172.217.138.71","TCP","54","54989  >  443 [ACK] Seq=16425 Ack=589045 Win=1023 Len=0"
"267","14.324238","172.217.138.71","172.20.24.104","TCP","2818","443  >  54989 [ACK] Seq=589045 Ack=16425 Win=978 Len=2764 [TCP PDU reassembled in 270]"
"268","14.324320","172.20.24.104","172.217.138.71","TCP","54","54989  >  443 [ACK] Seq=16425 Ack=591809 Win=1023 Len=0"
"269","14.325624","172.217.138.71","172.20.24.104","TCP","1436","443  >  54989 [ACK] Seq=591809 Ack=16425 Win=978 Len=1382 [TCP PDU reassembled in 270]"
"270","14.328445","172.217.138.71","172.20.24.104","TLSv1.2","44278","Application Data, Application Data, Application Data"
"271","14.328531","172.20.24.104","172.217.138.71","TCP","54","54989  >  443 [ACK] Seq=16425 Ack=637415 Win=1023 Len=0"
"272","14.329172","172.217.138.71","172.20.24.104","TCP","2818","443  >  54989 [ACK] Seq=637415 Ack=16425 Win=978 Len=2764 [TCP PDU reassembled in 276]"
"273","14.329251","172.20.24.104","172.217.138.71","TCP","54","54989  >  443 [ACK] Seq=16425 Ack=640179 Win=1023 Len=0"
"274","14.330518","172.217.138.71","172.20.24.104","TCP","1436","443  >  54989 [ACK] Seq=640179 Ack=16425 Win=978 Len=1382 [TCP PDU reassembled in 276]"
"275","14.330583","172.20.24.104","172.217.138.71","TCP","54","54989  >  443 [ACK] Seq=16425 Ack=641561 Win=1023 Len=0"
"276","14.332873","172.217.138.71","172.20.24.104","TLSv1.2","38750","Application Data, Application Data"
"277","14.332873","172.217.138.71","172.20.24.104","TCP","714","443  >  54989 [PSH, ACK] Seq=680257 Ack=16425 Win=978 Len=660 [TCP PDU reassembled in 280]"
"278","14.332873","172.217.138.71","172.20.24.104","TCP","1436","443  >  54989 [ACK] Seq=680917 Ack=16425 Win=978 Len=1382 [TCP PDU reassembled in 280]"
"279","14.332994","172.20.24.104","172.217.138.71","TCP","54","54989  >  443 [ACK] Seq=16425 Ack=682299 Win=1023 Len=0"
"280","14.333540","172.217.138.71","172.20.24.104","TLSv1.2","2818","Application Data"
"281","14.333582","172.20.24.104","172.217.138.71","TCP","54","54989  >  443 [ACK] Seq=16425 Ack=685063 Win=1023 Len=0"
"282","14.334699","172.217.138.71","172.20.24.104","TLSv1.2","601","Application Data, Application Data, Application Data, Application Data, Application Data, Application Data"
"283","14.336796","172.20.24.104","142.250.206.3","TLSv1.2","123","Ignored Unknown Record"
"284","14.336939","172.20.24.104","142.250.206.3","TLSv1.2","93","Application Data"
"285","14.337008","172.20.24.104","142.250.206.3","TLSv1.2","379","Application Data"
"286","14.338247","142.250.206.3","172.20.24.104","TCP","60","443  >  53186 [ACK] Seq=1 Ack=71 Win=438 Len=0"
"287","14.338709","142.250.206.3","172.20.24.104","TCP","60","443  >  53186 [ACK] Seq=1 Ack=110 Win=438 Len=0"
"288","14.338709","142.250.206.3","172.20.24.104","TCP","60","443  >  53186 [ACK] Seq=1 Ack=435 Win=449 Len=0"
"289","14.343609","142.250.206.3","172.20.24.104","TLSv1.2","93","Application Data"
"290","14.378920","172.20.24.104","172.217.138.71","TCP","54","54989  >  443 [ACK] Seq=16425 Ack=685610 Win=1021 Len=0"
"291","14.394425","172.20.24.104","142.250.206.3","TCP","54","53186  >  443 [ACK] Seq=435 Ack=40 Win=255 Len=0"
"292","14.395744","142.250.206.3","172.20.24.104","TLSv1.2","219","Application Data, Application Data, Application Data"
"293","14.397345","172.20.24.104","142.250.206.3","TLSv1.2","93","Application Data"
"294","14.397482","172.20.24.104","142.250.206.3","TLSv1.2","89","Application Data"
"295","14.398361","172.20.24.104","172.64.41.3","TLSv1.2","110","Application Data"
"296","14.398497","172.20.24.104","172.64.41.3","TLSv1.2","93","Application Data"
"297","14.398581","172.20.24.104","172.64.41.3","TLSv1.2","110","Application Data"
"298","14.398666","172.20.24.104","172.64.41.3","TLSv1.2","213","Application Data"
"299","14.398809","172.20.24.104","172.64.41.3","TLSv1.2","213","Application Data"
"300","14.399422","142.250.206.3","172.20.24.104","TCP","60","443  >  53186 [ACK] Seq=205 Ack=509 Win=449 Len=0"
"301","14.403387","172.64.41.3","172.20.24.104","TCP","60","443  >  53164 [ACK] Seq=1 Ack=57 Win=31 Len=0"
"302","14.403387","172.64.41.3","172.20.24.104","TCP","60","443  >  53164 [ACK] Seq=1 Ack=96 Win=31 Len=0"
"303","14.403387","172.64.41.3","172.20.24.104","TCP","60","443  >  53164 [ACK] Seq=1 Ack=152 Win=31 Len=0"
"304","14.403387","172.64.41.3","172.20.24.104","TCP","60","443  >  53164 [ACK] Seq=1 Ack=311 Win=31 Len=0"
"305","14.403387","172.64.41.3","172.20.24.104","TCP","60","443  >  53164 [ACK] Seq=1 Ack=470 Win=31 Len=0"
"306","14.403669","172.64.41.3","172.20.24.104","TLSv1.2","89","Application Data"
"307","14.468221","172.20.24.104","172.64.41.3","TCP","54","53164  >  443 [ACK] Seq=470 Ack=36 Win=251 Len=0"
"308","14.469565","172.64.41.3","172.20.24.104","TLSv1.2","1226","Application Data, Application Data, Application Data, Application Data, Application Data"
"309","14.470136","172.20.24.104","172.64.41.3","TLSv1.2","89","Application Data"
"310","14.470378","172.20.24.104","34.17.18.17","TCP","66","55857  >  443 [SYN] Seq=0 Win=65535 Len=0 MSS=1460 WS=256 SACK_PERM"
"311","14.516576","172.64.41.3","172.20.24.104","TCP","60","443  >  53164 [ACK] Seq=1208 Ack=505 Win=31 Len=0"
"312","14.642310","34.17.18.17","172.20.24.104","TCP","66","443  >  55857 [SYN, ACK] Seq=0 Ack=1 Win=64240 Len=0 MSS=1382 SACK_PERM WS=128"
"313","14.642468","172.20.24.104","34.17.18.17","TCP","54","55857  >  443 [ACK] Seq=1 Ack=1 Win=65280 Len=0"
"314","14.643879","172.20.24.104","34.17.18.17","TLSv1.3","1846","Client Hello (SNI=e2c61.gcp.gvt2.com)"
"315","14.645731","34.17.18.17","172.20.24.104","TCP","60","443  >  55857 [ACK] Seq=1 Ack=1383 Win=62976 Len=0"
"316","14.646095","34.17.18.17","172.20.24.104","TCP","60","443  >  55857 [ACK] Seq=1 Ack=1793 Win=62592 Len=0"
"317","15.142039","34.17.18.17","172.20.24.104","TLSv1.3","1436","Server Hello, Change Cipher Spec, Application Data"
"318","15.143381","34.17.18.17","172.20.24.104","TCP","1436","443  >  55857 [PSH, ACK] Seq=1383 Ack=1793 Win=62592 Len=1382 [TCP PDU reassembled in 321]"
"319","15.143381","34.17.18.17","172.20.24.104","TCP","1436","443  >  55857 [ACK] Seq=2765 Ack=1793 Win=62592 Len=1382 [TCP PDU reassembled in 321]"
"320","15.143420","172.20.24.104","34.17.18.17","TCP","54","55857  >  443 [ACK] Seq=1793 Ack=4147 Win=65280 Len=0"
"321","15.144865","34.17.18.17","172.20.24.104","TLSv1.3","637","Application Data, Application Data, Application Data, Application Data"
"322","15.144896","172.20.24.104","34.17.18.17","TCP","54","55857  >  443 [ACK] Seq=1793 Ack=4730 Win=64768 Len=0"
"323","15.147513","172.20.24.104","34.17.18.17","TLSv1.3","118","Change Cipher Spec, Application Data"
"324","15.147857","172.20.24.104","34.17.18.17","TLSv1.3","146","Application Data"
"325","15.148052","172.20.24.104","34.17.18.17","TLSv1.3","276","Application Data"
"326","15.148111","172.20.24.104","34.17.18.17","TLSv1.3","379","Application Data"
"327","15.149676","34.17.18.17","172.20.24.104","TCP","60","443  >  55857 [ACK] Seq=4730 Ack=1857 Win=62592 Len=0"
"328","15.150716","34.17.18.17","172.20.24.104","TCP","60","443  >  55857 [ACK] Seq=4730 Ack=1949 Win=62592 Len=0"
"329","15.150716","34.17.18.17","172.20.24.104","TCP","60","443  >  55857 [ACK] Seq=4730 Ack=2171 Win=62464 Len=0"
"330","15.151115","34.17.18.17","172.20.24.104","TCP","60","443  >  55857 [ACK] Seq=4730 Ack=2496 Win=62208 Len=0"
"331","15.317124","34.17.18.17","172.20.24.104","TLSv1.3","109","Application Data"
"332","15.317516","172.20.24.104","34.17.18.17","TLSv1.3","85","Application Data"
"333","15.319434","34.17.18.17","172.20.24.104","TCP","60","443  >  55857 [ACK] Seq=4785 Ack=2527 Win=62208 Len=0"
"334","15.483310","34.17.18.17","172.20.24.104","TLSv1.3","89","Application Data"
"335","15.529646","172.20.24.104","34.17.18.17","TCP","54","55857  >  443 [ACK] Seq=2527 Ack=4820 Win=64768 Len=0"
"336","15.531319","34.17.18.17","172.20.24.104","TLSv1.3","157","Application Data, Application Data"
"337","15.531770","172.20.24.104","34.17.18.17","TLSv1.3","89","Application Data"
